<?xml version="1.0" encoding="UTF-8"?>

<videoLibrary
        xmlns:xsi='http://www.w3.org/2001/XMLSchema-instance'
        xsi:noNamespaceSchemaLocation='scheme.xsd'>

    <categories>
        <category name="Movies" price="5.90">
            <medium id="1">
                <mediumType>DVD</mediumType>
                <name>Shrek</name>
                <length>90</length>
                <actors>
                    <actor>Mike Myers</actor>
                    <actor>Eddie Murphy</actor>
                    <actor>Cameron Diaz</actor>
                </actors>
                <status>available</status>
                <genres>
                    <genre>Animated</genre>
                    <genre>Adventure</genre>
                    <genre>Comedy</genre>
                </genres>
                <releaseYear>2001</releaseYear>
            </medium>
            <medium id="2">
                <mediumType>VHS</mediumType>
                <name>Lemonade Joe</name>
                <length>84</length>
                <actors>
                    <actor>Karel Fiala</actor>
                    <actor>Rudolf Deyl</actor>
                    <actor>Miloš Kopecký</actor>
                </actors>
                <status>broken</status>
                <genres>
                    <genre>Adventure</genre>
                    <genre>Comedy</genre>
                    <genre>Musical</genre>
                </genres>
                <releaseYear>1964</releaseYear>
            </medium>
            <medium id="3">
                <mediumType>USB</mediumType>
                <name>Sex and the City</name>
                <length>145</length>
                <actors>
                    <actor>Sarah Jessica Parker</actor>
                    <actor>Kim Cattrall</actor>
                    <actor>Cynthia Nixon</actor>
                </actors>
                <status>lost</status>
                <genres>
                    <genre>Comedy</genre>
                    <genre>Drama</genre>
                    <genre>Romance</genre>
                </genres>
                <releaseYear>2008</releaseYear>
            </medium>
        </category>
        <category name="Guides and Tutorials" price="10.90">
            <medium id="4">
                <mediumType>DVD</mediumType>
                <name>Photoshop CS6 Tutorial Training</name>
                <length>1200</length>
                <status>available</status>
                <releaseYear>2015</releaseYear>
            </medium>
            <medium id="5">
                <mediumType>DVD</mediumType>
                <name>Dance Lessons 101: The Basics and Beyond!</name>
                <length>unknown</length>
                <status>rented</status>
                <releaseYear>2012</releaseYear>
            </medium>
        </category>
    </categories>
</videoLibrary>